[{"capability_id":"capability:l9-gate-sdk:library","confidence":{"authority":"validated-machine","completeness":"sufficient","conflict_status":"none","derivation_method":"deterministic","evidence_strength":"corroborated","level":"high"},"description":"Repository role capability observed for l9-gate-sdk.","evidence_refs":["evidence:08ca8f0cd96a01443445b6387276901fbaf327dffc2300a6db16a341bf1959ef","evidence:2b5e0a5f4722f1f0912ed76f4154d926770011124bcbddbc892f04c67c9d4b15","evidence:557d52b82c0b9cf39a92ad68dc6f894ce490cfced8974cea75adcd3eea642d8e","evidence:77ea38aad92ee15e35e79e63a72d6bf1578f61a214f76d96efe25ccbcbd4412c","evidence:9745cf9f5aa2a55d0d0ec956f595a9102051224f6da654c5e756128b06ba6c50"],"exposed_by":[],"governed_by":[],"implemented_by":["repo:l9-gate-sdk"],"name":"library","validated_by":[]},{"capability_id":"capability:l9-gate-sdk:topology","confidence":{"authority":"validated-machine","completeness":"sufficient","conflict_status":"none","derivation_method":"deterministic","evidence_strength":"corroborated","level":"high"},"description":"Repository role capability observed for l9-gate-sdk.","evidence_refs":["evidence:08ca8f0cd96a01443445b6387276901fbaf327dffc2300a6db16a341bf1959ef","evidence:2b5e0a5f4722f1f0912ed76f4154d926770011124bcbddbc892f04c67c9d4b15","evidence:557d52b82c0b9cf39a92ad68dc6f894ce490cfced8974cea75adcd3eea642d8e","evidence:77ea38aad92ee15e35e79e63a72d6bf1578f61a214f76d96efe25ccbcbd4412c","evidence:9745cf9f5aa2a55d0d0ec956f595a9102051224f6da654c5e756128b06ba6c50"],"exposed_by":[],"governed_by":[],"implemented_by":["repo:l9-gate-sdk"],"name":"topology","validated_by":[]},{"capability_id":"capability:l9-mcp-server:service","confidence":{"authority":"validated-machine","completeness":"sufficient","conflict_status":"none","derivation_method":"deterministic","evidence_strength":"corroborated","level":"high"},"description":"Repository role capability observed for l9-mcp-server.","evidence_refs":["evidence:053ade54eab180cfb6442885f9b719e70855791f3ca2005aaf8172f26077af5a","evidence:69a738878ad517887bb645a85d8020726f36ac3d8c9b988befd492ab82c9f402","evidence:8f4331cf9239c6121cb63ea3568998cdf31f0cf1cc1beef54201ac03d6ebd525","evidence:944d594375fc539e595d57462092de4c3af2837ec28ab2be4712373efd08be46","evidence:c87556ab9f0ac784f89a55b400f8a6c61be905b44e23f5d40e47aaa6c4a376a5"],"exposed_by":[],"governed_by":[],"implemented_by":["repo:l9-mcp-server"],"name":"service","validated_by":[]},{"capability_id":"capability:l9-mcp-server:topology","confidence":{"authority":"validated-machine","completeness":"sufficient","conflict_status":"none","derivation_method":"deterministic","evidence_strength":"corroborated","level":"high"},"description":"Repository role capability observed for l9-mcp-server.","evidence_refs":["evidence:053ade54eab180cfb6442885f9b719e70855791f3ca2005aaf8172f26077af5a","evidence:69a738878ad517887bb645a85d8020726f36ac3d8c9b988befd492ab82c9f402","evidence:8f4331cf9239c6121cb63ea3568998cdf31f0cf1cc1beef54201ac03d6ebd525","evidence:944d594375fc539e595d57462092de4c3af2837ec28ab2be4712373efd08be46","evidence:c87556ab9f0ac784f89a55b400f8a6c61be905b44e23f5d40e47aaa6c4a376a5"],"exposed_by":[],"governed_by":[],"implemented_by":["repo:l9-mcp-server"],"name":"topology","validated_by":[]}]
